{
  "mova_version": "4.0.0",
  "envelope_type": "env.file_cleanup_plan_request_v1",
  "envelope_id": "file_cleanup_plan_local_downloads_v1",
  "requested_by": "sergii",
  "snapshot": {
    "$ref": "lab/examples/ds.file_cleanup_snapshot_v1.local_downloads.json"
  },
  "preferences": {
    "max_age_days_for_temp": 90,
    "min_size_bytes_for_archive": 100000000,
    "aggressiveness": "balanced",
    "never_delete_extensions": [
      "key",
      "kdbx"
    ]
  }
}
